{"declarations":[{"applications":[{"arguments":[{"id":"559393d9caadcab15da73eb8d4596e92711534a74fd1ef01ca813150c5d98ae0","tag":"primitive"}],"constructors":[{"name":"None","ordinal":0,"payload":[]},{"name":"Some","ordinal":1,"payload":[{"name":"value","type":{"id":"559393d9caadcab15da73eb8d4596e92711534a74fd1ef01ca813150c5d98ae0","tag":"primitive"}}]}],"id":"e19196584c79aa5d380e7eb0560d9aad17765a2b9681a204637f3bb695e8a9d6"},{"arguments":[{"arguments":[{"id":"559393d9caadcab15da73eb8d4596e92711534a74fd1ef01ca813150c5d98ae0","tag":"primitive"}],"id":"c1ab3d85f0061ea80f29d195fe4335430801e7e5267b9b78f7fe3ecf8f000cf7","tag":"nominal"}],"constructors":[{"name":"None","ordinal":0,"payload":[]},{"name":"Some","ordinal":1,"payload":[{"name":"value","type":{"arguments":[{"id":"559393d9caadcab15da73eb8d4596e92711534a74fd1ef01ca813150c5d98ae0","tag":"primitive"}],"id":"c1ab3d85f0061ea80f29d195fe4335430801e7e5267b9b78f7fe3ecf8f000cf7","tag":"nominal"}}]}],"id":"ed4ce10ba3459c3707f7db01894cc1847c7a9c734d1c961a8559d7ae61b542e7"},{"arguments":[{"arguments":[{"id":"559393d9caadcab15da73eb8d4596e92711534a74fd1ef01ca813150c5d98ae0","tag":"primitive"},{"id":"69a7392d6aa05c1229a8250aef3b369e4a37dfc4a49929e9e0bfe256ea32e46c","tag":"primitive"}],"id":"1c4ebcb948f6f172c354b5172be8213f1f80ffd2b5501364e7fd9098a59035fb","tag":"nominal"}],"constructors":[{"name":"None","ordinal":0,"payload":[]},{"name":"Some","ordinal":1,"payload":[{"name":"value","type":{"arguments":[{"id":"559393d9caadcab15da73eb8d4596e92711534a74fd1ef01ca813150c5d98ae0","tag":"primitive"},{"id":"69a7392d6aa05c1229a8250aef3b369e4a37dfc4a49929e9e0bfe256ea32e46c","tag":"primitive"}],"id":"1c4ebcb948f6f172c354b5172be8213f1f80ffd2b5501364e7fd9098a59035fb","tag":"nominal"}}]}],"id":"73c123965152e6272772c25f711f9404f9ecfd2925e296cd90fe570d056a6b9f"}],"binders":[{"id":"74ed4715babafe1e4bab26069bcf1bfe0e35322167cb0347098dffe6b48641ae","kind":"type","ordinal":0}],"constructors":[{"name":"None","ordinal":0,"payload":[]},{"name":"Some","ordinal":1,"payload":[{"name":"value","type":{"id":"74ed4715babafe1e4bab26069bcf1bfe0e35322167cb0347098dffe6b48641ae","tag":"parameter"}}]}],"id":"c1ab3d85f0061ea80f29d195fe4335430801e7e5267b9b78f7fe3ecf8f000cf7","kind":"adt","name":"Opt"},{"applications":[{"arguments":[{"id":"559393d9caadcab15da73eb8d4596e92711534a74fd1ef01ca813150c5d98ae0","tag":"primitive"},{"id":"69a7392d6aa05c1229a8250aef3b369e4a37dfc4a49929e9e0bfe256ea32e46c","tag":"primitive"}],"constructors":[{"name":"Left","ordinal":0,"payload":[{"name":"left","type":{"id":"559393d9caadcab15da73eb8d4596e92711534a74fd1ef01ca813150c5d98ae0","tag":"primitive"}}]},{"name":"Right","ordinal":1,"payload":[{"name":"right","type":{"id":"69a7392d6aa05c1229a8250aef3b369e4a37dfc4a49929e9e0bfe256ea32e46c","tag":"primitive"}}]}],"id":"4f9676e34672c714be176e1dc54bf5ffd784afc773f7651542d1a23e10da4a3e"}],"binders":[{"id":"47903f3142a513cf1dd741a2e7c212c6c35604e9ab52ad5d7147c42c5e7283cd","kind":"type","ordinal":0},{"id":"273c9811588803c684ed7ba72baf63c279d9d0027ee395ed8c8137c727c33a03","kind":"type","ordinal":1}],"constructors":[{"name":"Left","ordinal":0,"payload":[{"name":"left","type":{"id":"47903f3142a513cf1dd741a2e7c212c6c35604e9ab52ad5d7147c42c5e7283cd","tag":"parameter"}}]},{"name":"Right","ordinal":1,"payload":[{"name":"right","type":{"id":"273c9811588803c684ed7ba72baf63c279d9d0027ee395ed8c8137c727c33a03","tag":"parameter"}}]}],"id":"1c4ebcb948f6f172c354b5172be8213f1f80ffd2b5501364e7fd9098a59035fb","kind":"adt","name":"Either"},{"applications":[{"arguments":[{"id":"559393d9caadcab15da73eb8d4596e92711534a74fd1ef01ca813150c5d98ae0","tag":"primitive"}],"fields":[{"name":"value","type":{"id":"559393d9caadcab15da73eb8d4596e92711534a74fd1ef01ca813150c5d98ae0","tag":"primitive"}}],"id":"72b63ae50646beeaf76ff95ca7366e42f3ef80eab96cca36c82e337f801e8495"}],"binders":[{"id":"6cf7dbf2ee639570fad6de369a72d09adc6a0904e3b3fa8dad1817ae7b3d9e80","kind":"type","ordinal":0}],"fields":[{"name":"value","type":{"id":"6cf7dbf2ee639570fad6de369a72d09adc6a0904e3b3fa8dad1817ae7b3d9e80","tag":"parameter"}}],"id":"6d18a633567d46aa404542f81555afcfdc9f80b410c3a44b6729affb7777a708","kind":"record","name":"Box"},{"applications":[{"arguments":[{"id":"48b8247e13d5b248e40bd12656537cb0e378352dcd18d81ce4ae7584677e491b","tag":"primitive"}],"constructors":[{"name":"Absent","ordinal":0,"payload":[]},{"name":"Present","ordinal":1,"payload":[{"name":"inner","type":{"arguments":[{"id":"48b8247e13d5b248e40bd12656537cb0e378352dcd18d81ce4ae7584677e491b","tag":"primitive"}],"id":"c1ab3d85f0061ea80f29d195fe4335430801e7e5267b9b78f7fe3ecf8f000cf7","tag":"nominal"}}]}],"id":"ad5e739e1a64b54aa890bade19120378d57b2add51ad4b952deed2df6288431b"},{"arguments":[{"arguments":[{"id":"559393d9caadcab15da73eb8d4596e92711534a74fd1ef01ca813150c5d98ae0","tag":"primitive"}],"id":"6d18a633567d46aa404542f81555afcfdc9f80b410c3a44b6729affb7777a708","tag":"nominal"}],"constructors":[{"name":"Absent","ordinal":0,"payload":[]},{"name":"Present","ordinal":1,"payload":[{"name":"inner","type":{"arguments":[{"arguments":[{"id":"559393d9caadcab15da73eb8d4596e92711534a74fd1ef01ca813150c5d98ae0","tag":"primitive"}],"id":"6d18a633567d46aa404542f81555afcfdc9f80b410c3a44b6729affb7777a708","tag":"nominal"}],"id":"c1ab3d85f0061ea80f29d195fe4335430801e7e5267b9b78f7fe3ecf8f000cf7","tag":"nominal"}}]}],"id":"3580159f4e492dbfb3bd87ad25ed33d9cc761d97d0ac44a8e5f14d76d78e99ff"}],"binders":[{"id":"3837f5dbffc44e344deadd81b79b533b1111f20e077dd463542dcda5bca301ad","kind":"type","ordinal":0}],"constructors":[{"name":"Absent","ordinal":0,"payload":[]},{"name":"Present","ordinal":1,"payload":[{"name":"inner","type":{"arguments":[{"id":"3837f5dbffc44e344deadd81b79b533b1111f20e077dd463542dcda5bca301ad","tag":"parameter"}],"id":"c1ab3d85f0061ea80f29d195fe4335430801e7e5267b9b78f7fe3ecf8f000cf7","tag":"nominal"}}]}],"id":"520700ed5f25df9a2b9db41ddf13c53615b5254ecc86ac8f0ffb8e55d441553e","kind":"adt","name":"Wrapped"},{"applications":[{"arguments":[{"id":"559393d9caadcab15da73eb8d4596e92711534a74fd1ef01ca813150c5d98ae0","tag":"primitive"}],"constructors":[{"name":"Empty","ordinal":0,"payload":[]},{"name":"Held","ordinal":1,"payload":[{"name":"box","type":{"arguments":[{"id":"559393d9caadcab15da73eb8d4596e92711534a74fd1ef01ca813150c5d98ae0","tag":"primitive"}],"id":"6d18a633567d46aa404542f81555afcfdc9f80b410c3a44b6729affb7777a708","tag":"nominal"}}]}],"id":"d1431359412a9f19d551ab6a47b956511f56be90386805a8c009ff6d1bfb6f5f"}],"binders":[{"id":"e1a60cdc6a1c566bdf343a0ab394bdc207879d92196edfc734114428a2872d54","kind":"type","ordinal":0}],"constructors":[{"name":"Empty","ordinal":0,"payload":[]},{"name":"Held","ordinal":1,"payload":[{"name":"box","type":{"arguments":[{"id":"e1a60cdc6a1c566bdf343a0ab394bdc207879d92196edfc734114428a2872d54","tag":"parameter"}],"id":"6d18a633567d46aa404542f81555afcfdc9f80b410c3a44b6729affb7777a708","tag":"nominal"}}]}],"id":"ac8a3cb4a92e96280eb7b4ba9defd62e0c0625af749a7e954754bb796a407caa","kind":"adt","name":"Holder"},{"applications":[{"arguments":[{"id":"69a7392d6aa05c1229a8250aef3b369e4a37dfc4a49929e9e0bfe256ea32e46c","tag":"primitive"}],"fields":[{"name":"content","type":{"arguments":[{"id":"69a7392d6aa05c1229a8250aef3b369e4a37dfc4a49929e9e0bfe256ea32e46c","tag":"primitive"}],"id":"c1ab3d85f0061ea80f29d195fe4335430801e7e5267b9b78f7fe3ecf8f000cf7","tag":"nominal"}}],"id":"f64824c55ccb177882a7d26f664d0231f9e448a1a568a5ea13e718ad5a8ef8f4"}],"binders":[{"id":"6235ae054d15ba360b34d87d319a08156c8c5453a7233bf82a09e6b6d7523067","kind":"type","ordinal":0}],"fields":[{"name":"content","type":{"arguments":[{"id":"6235ae054d15ba360b34d87d319a08156c8c5453a7233bf82a09e6b6d7523067","tag":"parameter"}],"id":"c1ab3d85f0061ea80f29d195fe4335430801e7e5267b9b78f7fe3ecf8f000cf7","tag":"nominal"}}],"id":"4372aafc1fae3d8d3ba4ca28d417c619c4b479a73ab6f840b215f9e9e4638038","kind":"record","name":"Slot"},{"applications":[{"arguments":[{"id":"559393d9caadcab15da73eb8d4596e92711534a74fd1ef01ca813150c5d98ae0","tag":"primitive"}],"constructors":[{"name":"Plain","ordinal":0,"payload":[{"name":"value","type":{"id":"559393d9caadcab15da73eb8d4596e92711534a74fd1ef01ca813150c5d98ae0","tag":"primitive"}}]},{"name":"Colored","ordinal":1,"payload":[{"name":"color","type":{"arguments":[],"id":"05f5bf70fcce7d34a90d135cd5ec0d16752af062b09bee8ed16dd4bb5bca9831","tag":"nominal"}}]}],"id":"91fdf417e0c639c66e16782134245a6decedae4e8f4a58cc94b8cedfbf5bf79f"}],"binders":[{"id":"69ccd256c97ab0835717beb96378fa48685de5e9f2ef2e387d11d305cddc6200","kind":"type","ordinal":0}],"constructors":[{"name":"Plain","ordinal":0,"payload":[{"name":"value","type":{"id":"69ccd256c97ab0835717beb96378fa48685de5e9f2ef2e387d11d305cddc6200","tag":"parameter"}}]},{"name":"Colored","ordinal":1,"payload":[{"name":"color","type":{"arguments":[],"id":"05f5bf70fcce7d34a90d135cd5ec0d16752af062b09bee8ed16dd4bb5bca9831","tag":"nominal"}}]}],"id":"7ce8fdb2de661869dfcd9270eec4bbd015c4ae3c0d0d8498acb9d2ebad618916","kind":"adt","name":"Tagged"},{"applications":[{"arguments":[{"id":"9091cbfb7e891a1026ef176d558d1167d17b98a64b8979e72a87320b8396c9d0","tag":"primitive"}],"constructors":[{"name":"Never","ordinal":0,"payload":[]},{"name":"Later","ordinal":1,"payload":[{"name":"next","type":{"arguments":[{"arguments":[{"id":"9091cbfb7e891a1026ef176d558d1167d17b98a64b8979e72a87320b8396c9d0","tag":"primitive"}],"id":"c1ab3d85f0061ea80f29d195fe4335430801e7e5267b9b78f7fe3ecf8f000cf7","tag":"nominal"}],"id":"c1ab3d85f0061ea80f29d195fe4335430801e7e5267b9b78f7fe3ecf8f000cf7","tag":"nominal"}}]}],"id":"866645807c4ee5d7362e9aec3ea784a9f789cc71a9521872ad7ffc38bbbc45ff"}],"binders":[{"id":"5d9e98716c5961c9a8af188317e53e4d5dc8124b375b6ce9d1add82f82bf30be","kind":"type","ordinal":0}],"constructors":[{"name":"Never","ordinal":0,"payload":[]},{"name":"Later","ordinal":1,"payload":[{"name":"next","type":{"arguments":[{"arguments":[{"id":"5d9e98716c5961c9a8af188317e53e4d5dc8124b375b6ce9d1add82f82bf30be","tag":"parameter"}],"id":"c1ab3d85f0061ea80f29d195fe4335430801e7e5267b9b78f7fe